{
  "schema_version": "0.1.0",
  "kind": "star_system",
  "id": "manticore",
  "name": "Manticore System",
  "aliases": ["Manticore Binary System", "Manticore-A/B"],
  "star_nation_id": "star-kingdom-of-manticore",
  "canon": true,
  "sources": ["HH1", "Companion", "HHA2:WPD", "Jayne's Intelligence Review v1"],
  "wiki_pages": [
    "https://honorverse.fandom.com/wiki/Manticore_System",
    "https://honorverse.fandom.com/wiki/Star_Kingdom_of_Manticore"
  ],
  "retrieved": "2026-06-13",

  "location": {
    "canon": true,
    "reference": "Sol",
    "distance_ly": 512,
    "direction": "galactic north",
    "galactic_coordinates": null,
    "source": "HH1, Companion",
    "notes": "Canon gives only distance and bearing from Sol ('512 light-years to the Galactic north of the Sol System and Earth'). No absolute galactic coordinates are established; a coordinate origin/axis convention will have to be defined (non-canon) before this can be placed on a 3D map."
  },

  "binary": {
    "canon": true,
    "type": "binary",
    "components": ["manticore-a", "manticore-b"],
    "barycenter_distance_from_a_lmin": 333,
    "barycenter_distance_from_b_lmin": 406,
    "eccentricity": 0.12,
    "separation_periastron_lmin": 650,
    "separation_apastron_lmin": 827,
    "orbital_period_days": null,
    "source": "Companion",
    "notes": "Apparent eccentricity 'approaches twelve percent'. Mutual orbital period is not stated in canon and will need to be derived (Kepler's third law from the masses and mean separation) or invented; flagged non-canon when filled. 1 light-minute = 1.798754748e10 m."
  },

  "stars": [
    {
      "id": "manticore-a",
      "name": "Manticore-A",
      "role": "primary",
      "spectral_type": "G0",
      "mass_solar": 1.12,
      "canon": true,
      "source": "Companion",
      "notes": "Hosts the two most Earth-like worlds (Manticore, Sphinx) and the bulk of system population/industry. Spectral type and mass are canon; radius, luminosity, temperature are not stated and would be inferred (non-canon) from the G0 classification if needed."
    },
    {
      "id": "manticore-b",
      "name": "Manticore-B",
      "role": "secondary",
      "spectral_type": "G2",
      "mass_solar": 0.92,
      "canon": true,
      "source": "Companion",
      "notes": "Hosts Gryphon plus the Unicorn Belt, the system's primary ore-extraction operation."
    }
  ],

  "bodies": [
    {
      "id": "salamander",
      "name": "Salamander",
      "designation": "Manticore-A I",
      "parent_star": "manticore-a",
      "orbit_index": 1,
      "type": "planet",
      "subtype": null,
      "habitable": false,
      "canon": true,
      "source": "Jayne's Intelligence Review v1",
      "moons": [],
      "orbit": {"canon": false, "determined": false, "a_au": null, "e": null, "i_deg": null, "L_deg": null, "long_peri_deg": null, "long_node_deg": null, "period_days": null, "notes": "Only orbital order is canon. Semi-major axis and full Keplerian elements must be invented to place this body."}
    },
    {
      "id": "phoenix",
      "name": "Phoenix",
      "designation": "Manticore-A II",
      "parent_star": "manticore-a",
      "orbit_index": 2,
      "type": "planet",
      "subtype": null,
      "habitable": false,
      "canon": true,
      "source": "Jayne's Intelligence Review v1",
      "moons": [],
      "orbit": {"canon": false, "determined": false, "a_au": null, "e": null, "i_deg": null, "L_deg": null, "long_peri_deg": null, "long_node_deg": null, "period_days": null, "notes": "Order canon; placement invented."}
    },
    {
      "id": "manticore",
      "name": "Manticore",
      "designation": "Manticore-A III",
      "parent_star": "manticore-a",
      "orbit_index": 3,
      "type": "planet",
      "subtype": "terrestrial",
      "habitable": true,
      "capital": true,
      "canon": true,
      "source": "HH1, Companion",
      "lore": "Capital world of the Star Kingdom; capital city is Landing. Extremely Earth-like, requiring only modest terraforming. Site of the Plague that killed ~60% of the original colonists before a vaccine was developed in 1496 PD.",
      "moons": [
        {"id": "thorson", "name": "Thorson", "canon": true, "source": "Jayne's Intelligence Review v1", "orbit": {"canon": false, "determined": false}},
        {"id": "manticore-unnamed-moons", "name": "37 additional unnamed moons", "count": 37, "named": false, "canon": true, "source": "HHA2:WPD", "orbit": {"canon": false, "determined": false}, "notes": "Canon states Manticore has 37 further moons beyond Thorson; none are individually named."}
      ],
      "orbit": {"canon": false, "determined": false, "a_au": null, "e": null, "i_deg": null, "L_deg": null, "long_peri_deg": null, "long_node_deg": null, "period_days": null, "notes": "A Manticoran year is canonically stated as 1.73 standard Terran years, which constrains the orbital period; a_au can be derived from that period plus Manticore-A's mass and then refined. Treat derived value as non-canon."}
    },
    {
      "id": "sphinx",
      "name": "Sphinx",
      "designation": "Manticore-A IV",
      "parent_star": "manticore-a",
      "orbit_index": 4,
      "type": "planet",
      "subtype": "terrestrial",
      "habitable": true,
      "canon": true,
      "source": "HH1, SK1, Companion",
      "lore": "Homeworld of the treecats, a native nonhuman sentient species discovered in 1518 PD by colonist Stephanie Harrington. Colonized as a quarantine 'citadel' during the Plague. Heavier gravity than Manticore.",
      "moons": [
        {"id": "perseus", "name": "Perseus", "canon": true, "source": "Jayne's Intelligence Review v1", "orbit": {"canon": false, "determined": false}},
        {"id": "bellerophon", "name": "Bellerophon", "canon": true, "source": "Jayne's Intelligence Review v1", "orbit": {"canon": false, "determined": false}}
      ],
      "orbit": {"canon": false, "determined": false, "a_au": null, "e": null, "i_deg": null, "L_deg": null, "long_peri_deg": null, "long_node_deg": null, "period_days": null, "notes": "Order canon; placement invented."}
    },
    {
      "id": "draco",
      "name": "Draco",
      "designation": "Manticore-A V",
      "parent_star": "manticore-a",
      "orbit_index": 5,
      "type": "planet",
      "subtype": "gas_giant",
      "habitable": false,
      "canon": true,
      "source": "Jayne's Intelligence Review v1",
      "moons": [],
      "orbit": {"canon": false, "determined": false, "a_au": null, "e": null, "i_deg": null, "L_deg": null, "long_peri_deg": null, "long_node_deg": null, "period_days": null}
    },
    {
      "id": "roc",
      "name": "Roc",
      "designation": "Manticore-A VI",
      "parent_star": "manticore-a",
      "orbit_index": 6,
      "type": "planet",
      "subtype": "gas_giant",
      "habitable": false,
      "canon": true,
      "source": "Jayne's Intelligence Review v1",
      "moons": [],
      "orbit": {"canon": false, "determined": false, "a_au": null, "e": null, "i_deg": null, "L_deg": null, "long_peri_deg": null, "long_node_deg": null, "period_days": null}
    },
    {
      "id": "wyvern",
      "name": "Wyvern",
      "designation": "Manticore-A VII",
      "parent_star": "manticore-a",
      "orbit_index": 7,
      "type": "planet",
      "subtype": "gas_giant",
      "habitable": false,
      "canon": true,
      "source": "Jayne's Intelligence Review v1",
      "moons": [],
      "orbit": {"canon": false, "determined": false, "a_au": null, "e": null, "i_deg": null, "L_deg": null, "long_peri_deg": null, "long_node_deg": null, "period_days": null}
    },

    {
      "id": "erinye",
      "name": "Erinye",
      "designation": "Manticore-B I",
      "parent_star": "manticore-b",
      "orbit_index": 1,
      "type": "planet",
      "subtype": null,
      "habitable": false,
      "canon": true,
      "source": "Jayne's Intelligence Review v1",
      "moons": [],
      "orbit": {"canon": false, "determined": false, "a_au": null, "e": null, "i_deg": null, "L_deg": null, "long_peri_deg": null, "long_node_deg": null, "period_days": null}
    },
    {
      "id": "gorgon",
      "name": "Gorgon",
      "designation": "Manticore-B II",
      "parent_star": "manticore-b",
      "orbit_index": 2,
      "type": "planet",
      "subtype": null,
      "habitable": false,
      "canon": true,
      "source": "Jayne's Intelligence Review v1",
      "moons": [],
      "orbit": {"canon": false, "determined": false, "a_au": null, "e": null, "i_deg": null, "L_deg": null, "long_peri_deg": null, "long_node_deg": null, "period_days": null}
    },
    {
      "id": "aphrodite",
      "name": "Aphrodite",
      "designation": "Manticore-B III",
      "parent_star": "manticore-b",
      "orbit_index": 3,
      "type": "planet",
      "subtype": null,
      "habitable": false,
      "canon": true,
      "source": "Jayne's Intelligence Review v1",
      "moons": [],
      "orbit": {"canon": false, "determined": false, "a_au": null, "e": null, "i_deg": null, "L_deg": null, "long_peri_deg": null, "long_node_deg": null, "period_days": null}
    },
    {
      "id": "damocles",
      "name": "Damocles",
      "designation": "Manticore-B IV",
      "parent_star": "manticore-b",
      "orbit_index": 4,
      "type": "planet",
      "subtype": null,
      "habitable": false,
      "canon": true,
      "source": "Jayne's Intelligence Review v1",
      "moons": [],
      "orbit": {"canon": false, "determined": false, "a_au": null, "e": null, "i_deg": null, "L_deg": null, "long_peri_deg": null, "long_node_deg": null, "period_days": null}
    },
    {
      "id": "gryphon",
      "name": "Gryphon",
      "designation": "Manticore-B V",
      "parent_star": "manticore-b",
      "orbit_index": 5,
      "type": "planet",
      "subtype": "terrestrial",
      "habitable": true,
      "canon": true,
      "source": "HH1, Companion",